Question 1
----------
TCP, TLS v1.2, HTTP

Question 2
----------
0.111243 Seconds

Question 3
----------
Server IP: 128.119.245.12
Me: 192.168.0.100

Question 4
----------
45	3.796476	192.168.0.100	128.119.245.12	HTTP	506	GET /wireshark-labs/INTRO-wireshark-file1.html HTTP/1.1
  Frame 45: 506 bytes on wire (4048 bits), 506 bytes captured (4048 bits) on interface 0
  Ethernet II, Src: Apple_e7:93:06 (24:f0:94:e7:93:06), Dst: Tp-LinkT_94:94:7e (70:4f:57:94:94:7e)
  Internet Protocol Version 4, Src: 192.168.0.100, Dst: 128.119.245.12
  Transmission Control Protocol, Src Port: 50094, Dst Port: 80, Seq: 1, Ack: 1, Len: 440
  Hypertext Transfer Protocol

48	3.907719	128.119.245.12	192.168.0.100	HTTP	504	HTTP/1.1 200 OK  (text/html)
  Frame 48: 504 bytes on wire (4032 bits), 504 bytes captured (4032 bits) on interface 0
  Ethernet II, Src: Tp-LinkT_94:94:7e (70:4f:57:94:94:7e), Dst: Apple_e7:93:06 (24:f0:94:e7:93:06)
  Internet Protocol Version 4, Src: 128.119.245.12, Dst: 192.168.0.100
  Transmission Control Protocol, Src Port: 80, Dst Port: 50094, Seq: 1, Ack: 441, Len: 438
  Hypertext Transfer Protocol
  Line-based text data: text/html (3 lines)
